{
  "$schema": "../../../shared/schemas/terrain.schema.json",
  "version": "1.0.0",
  "name": "Lucis Desert Expanse",
  "description": "Large open-world desert-style starting area inspired by FF15: broad central traversal basin with gentle dunes and elevated edge ridges to frame streaming boundaries.",
  "width": 128,
  "height": 128,
  "cellSize": 8.0,
  "heights": [
    8.109,
    8.136,
    8.162,
    8.184,
    8.202,
    8.214,
    8.217,
    8.211,
    8.196,
    8.169,
    8.13,
    8.079,
    8.016,
    7.94,
    7.852,
    7.753,
    7.643,
    7.524,
    7.396,
    7.261,
    7.121,
    6.976,
    6.83,
    6.683,
    6.537,
    6.395,
    6.258,
    6.127,
    6.004,
    5.891,
    5.788,
    5.698,
    5.619,
    5.554,
    5.502,
    5.463,
    5.437,
    5.425,
    5.424,
    5.435,
    5.456,
    5.486,
    5.524,
    5.568,
    5.616,
    5.666,
    5.718,
    5.769,
    5.817,
    5.861,
    5.9,
    5.931,
    5.955,
    5.969,
    5.973,
    5.967,
    5.949,
    5.92,
    5.881,
    5.831,
    5.771,
    5.702,
    5.624,
    5.54,
    5.451,
    5.358,
    5.263,
    5.167,
    5.073,
    4.982,
    4.896,
    4.817,
    4.747,
    4.686,
    4.636,
    4.599,
    4.575,
    4.565,
    4.57,
    4.59,
    4.624,
    4.673,
    4.737,
    4.814,
    4.903,
    5.004,
    5.115,
    5.235,
    5.361,
    5.493,
    5.629,
    5.766,
    5.903,
    6.038,
    6.17,
    6.297,
    6.417,
    6.53,
    6.634,
    6.729,
    6.813,
    6.886,
    6.949,
    7.001,
    7.043,
    7.075,
    7.098,
    7.114,
    7.122,
    7.125,
    7.125,
    7.122,
    7.118,
    7.116,
    7.117,
    7.122,
    7.134,
    7.154,
    7.182,
    7.222,
    7.273,
    7.336,
    7.413,
    7.503,
    7.607,
    7.724,
    7.855,
    7.999,
    8.04,
    8.066,
    8.092,
    8.114,
    8.131,
    8.142,
    8.145,
    8.139,
    8.122,
    8.094,
    8.055,
    8.003,
    7.939,
    7.862,
    7.774,
    7.674,
    7.563,
    7.443,
    7.314,
    7.178,
    7.036,
    6.891,
    6.744,
    6.596,
    6.449,
    6.306,
    6.167,
    6.035,
    5.911,
    5.797,
    5.693,
    5.601,
    5.521,
    5.455,
    5.401,
    5.361,
    5.335,
    5.321,
    5.319,
    5.329,
    5.349,
    5.378,
    5.414,
    5.456,
    5.503,
    5.553,
    5.603,
    5.653,
    5.7,
    5.743,
    5.781,
    5.812,
    5.834,
    5.847,
    5.85,
    5.843,
    5.825,
    5.795,
    5.755,
    5.704,
    5.644,
    5.574,
    5.496,
    5.412,
    5.322,
    5.229,
    5.133,
    5.037,
    4.943,
    4.852,
    4.766,
    4.687,
    4.616,
    4.555,
    4.506,
    4.468,
    4.445,
    4.435,
    4.44,
    4.46,
    4.495,
    4.545,
    4.609,
    4.686,
    4.776,
    4.878,
    4.989,
    5.109,
    5.237,
    5.369,
    5.505,
    5.643,
    5.781,
    5.917,
    6.05,
    6.178,
    6.299,
    6.413,
    6.518,
    6.614,
    6.699,
    6.773,
    6.837,
    6.89,
    6.933,
    6.966,
    6.991,
    7.007,
    7.017,
    7.021,
    7.021,
    7.02,
    7.017,
    7.016,
    7.018,
    7.025,
    7.037,
    7.058,
    7.088,
    7.128,
    7.18,
    7.245,
    7.322,
    7.413,
    7.518,
    7.637,
    7.769,
    7.914,
    7.964,
    7.991,
    8.015,
    8.037,
    8.054,
    8.064,
    8.066,
    8.059,
    8.042,
    8.014,
    7.973,
    7.921,
    7.856,
    7.779,
    7.689,
    7.588,
    7.477,
    7.355,
    7.225,
    7.088,
    6.946,
    6.799,
    6.651,
    6.502,
    6.354,
    6.209,
    6.07,
    5.936,
    5.811,
    5.696,
    5.591,
    5.497,
    5.416,
    5.349,
    5.294,
    5.253,
    5.225,
    5.21,
    5.207,
    5.215,
    5.234,
    5.262,
    5.297,
    5.338,
    5.384,
    5.432,
    5.482,
    5.53,
    5.577,
    5.619,
    5.655,
    5.685,
    5.706,
    5.719,
    5.721,
    5.713,
    5.694,
    5.664,
    5.623,
    5.572,
    5.51,
    5.44,
    5.362,
    5.277,
    5.187,
    5.093,
    4.997,
    4.901,
    4.807,
    4.715,
    4.629,
    4.55,
    4.479,
    4.418,
    4.369,
    4.332,
    4.309,
    4.299,
    4.305,
    4.325,
    4.36,
    4.41,
    4.475,
    4.553,
    4.643,
    4.745,
    4.858,
    4.979,
    5.107,
    5.24,
    5.377,
    5.516,
    5.654,
    5.791,
    5.925,
    6.054,
    6.176,
    6.291,
    6.397,
    6.493,
    6.58,
    6.655,
    6.72,
    6.774,
    6.818,
    6.853,
    6.878,
    6.895,
    6.906,
    6.911,
    6.913,
    6.912,
    6.911,
    6.911,
    6.914,
    6.921,
    6.935,
    6.957,
    6.988,
    7.029,
    7.082,
    7.148,
    7.227,
    7.319,
    7.425,
    7.544,
    7.677,
    7.823,
    7.883,
    7.909,
    7.933,
    7.954,
    7.97,
    7.98,
    7.982,
    7.974,
    7.956,
    7.927,
    7.886,
    7.833,
    7.767,
    7.688,
    7.598,
    7.496,
    7.384,
    7.261,
    7.13,
    6.992,
    6.849,
    6.701,
    6.551,
    6.401,
    6.252,
    6.106,
    5.966,
    5.831,
    5.705,
    5.588,
    5.482,
    5.387,
    5.305,
    5.236,
    5.18,
    5.138,
    5.109,
    5.092,
    5.088,
    5.095,
    5.113,
    5.139,
    5.173,
    5.213,
    5.258,
    5.305,
    5.354,
    5.401,
    5.446,
    5.487,
    5.523,
    5.552,
    5.572,
    5.584,
    5.585,
    5.576,
    5.557,
    5.526,
    5.484,
    5.432,
    5.37,
    5.3,
    5.221,
    5.136,
    5.045,
    4.951,
    4.855,
    4.759,
    4.664,
    4.573,
    4.487,
    4.407,
    4.337,
    4.276,
    4.227,
    4.19,
    4.167,
    4.158,
    4.163,
    4.184,
    4.22,
    4.271,
    4.335,
    4.414,
    4.505,
    4.608,
    4.721,
    4.842,
    4.971,
    5.105,
    5.243,
    5.383,
    5.522,
    5.66,
    5.795,
    5.925,
    6.048,
    6.164,
    6.271,
    6.368,
    6.455,
    6.532,
    6.598,
    6.653,
    6.698,
    6.734,
    6.76,
    6.778,
    6.79,
    6.797,
    6.799,
    6.8,
    6.8,
    6.801,
    6.805,
    6.813,
    6.828,
    6.851,
    6.883,
    6.925,
    6.979,
    7.046,
    7.126,
    7.219,
    7.326,
    7.446,
    7.58,
    7.726,
    7.796,
    7.822,
    7.845,
    7.866,
    7.881,
    7.89,
    7.891,
    7.883,
    7.864,
    7.834,
    7.792,
    7.738,
    7.671,
    7.592,
    7.501,
    7.398,
    7.284,
    7.161,
    7.029,
    6.89,
    6.745,
    6.597,
    6.446,
    6.294,
    6.144,
    5.997,
    5.855,
    5.72,
    5.592,
    5.474,
    5.366,
    5.271,
    5.187,
    5.117,
    5.06,
    5.016,
    4.986,
    4.968,
    4.963,
    4.969,
    4.985,
    5.01,
    5.043,
    5.082,
    5.126,
    5.172,
    5.219,
    5.265,
    5.31,
    5.35,
    5.384,
    5.412,
    5.432,
    5.443,
    5.443,
    5.434,
    5.413,
    5.382,
    5.339,
    5.287,
    5.224,
    5.153,
    5.074,
    4.988,
    4.898,
    4.803,
    4.707,
    4.61,
    4.516,
    4.424,
    4.338,
    4.259,
    4.188,
    4.128,
    4.079,
    4.042,
    4.019,
    4.01,
    4.017,
    4.038,
    4.074,
    4.125,
    4.191,
    4.27,
    4.362,
    4.465,
    4.579,
    4.701,
    4.831,
    4.966,
    5.104,
    5.245,
    5.385,
    5.524,
    5.66,
    5.79,
    5.915,
    6.031,
    6.139,
    6.238,
    6.326,
    6.404,
    6.471,
    6.527,
    6.573,
    6.61,
    6.637,
    6.657,
    6.67,
    6.677,
    6.681,
    6.682,
    6.683,
    6.686,
    6.691,
    6.7,
    6.716,
    6.74,
    6.773,
    6.816,
    6.872,
    6.939,
    7.02,
    7.114,
    7.221,
    7.343,
    7.477,
    7.625,
    7.704,
    7.729,
    7.752,
    7.772,
    7.787,
    7.795,
    7.795,
    7.786,
    7.766,
    7.736,
    7.693,
    7.638,
    7.57,
    7.49,
    7.398,
    7.294,
    7.179,
    7.055,
    6.922,
    6.782,
    6.636,
    6.486,
    6.334,
    6.181,
    6.03,
    5.882,
    5.739,
    5.602,
    5.473,
    5.354,
    5.245,
    5.148,
    5.063,
    4.992,
    4.933,
    4.888,
    4.857,
    4.838,
    4.831,
    4.836,
    4.851,
    4.875,
    4.907,
    4.945,
    4.987,
    5.032,
    5.078,
    5.124,
    5.167,
    5.206,
    5.24,
    5.267,
    5.285,
    5.295,
    5.295,
    5.285,
    5.264,
    5.231,
    5.189,
    5.135,
    5.073,
    5.001,
    4.921,
    4.835,
    4.744,
    4.65,
    4.553,
    4.457,
    4.362,
    4.27,
    4.184,
    4.105,
    4.035,
    3.974,
    3.925,
    3.889,
    3.867,
    3.858,
    3.865,
    3.887,
    3.923,
    3.975,
    4.041,
    4.121,
    4.213,
    4.318,
    4.432,
    4.555,
    4.685,
    4.821,
    4.961,
    5.102,
    5.244,
    5.383,
    5.52,
    5.652,
    5.777,
    5.895,
    6.004,
    6.103,
    6.193,
    6.271,
    6.339,
    6.397,
    6.444,
    6.482,
    6.51,
    6.531,
    6.545,
    6.553,
    6.558,
    6.561,
    6.563,
    6.566,
    6.572,
    6.583,
    6.6,
    6.625,
    6.659,
    6.703,
    6.759,
    6.827,
    6.909,
    7.004,
    7.113,
    7.235,
    7.37,
    7.519,
    7.607,
    7.631,
    7.654,
    7.673,
    7.687,
    7.694,
    7.694,
    7.684,
    7.663,
    7.632,
    7.588,
    7.532,
    7.464,
    7.383,
    7.289,
    7.184,
    7.069,
    6.943,
    6.809,
    6.668,
    6.521,
    6.37,
    6.217,
    6.063,
    5.91,
    5.761,
    5.617,
    5.479,
    5.349,
    5.228,
    5.118,
    5.02,
    4.934,
    4.861,
    4.801,
    4.755,
    4.722,
    4.702,
    4.694,
    4.698,
    4.712,
    4.735,
    4.765,
    4.802,
    4.843,
    4.887,
    4.932,
    4.976,
    5.018,
    5.057,
    5.089,
    5.115,
    5.133,
    5.142,
    5.142,
    5.13,
    5.109,
    5.076,
    5.032,
    4.979,
    4.915,
    4.843,
    4.763,
    4.677,
    4.586,
    4.491,
    4.394,
    4.298,
    4.203,
    4.111,
    4.025,
    3.946,
    3.876,
    3.816,
    3.767,
    3.731,
    3.709,
    3.701,
    3.708,
    3.731,
    3.768,
    3.82,
    3.887,
    3.967,
    4.061,
    4.166,
    4.281,
    4.405,
    4.536,
    4.673,
    4.813,
    4.955,
    5.098,
    5.239,
    5.376,
    5.509,
    5.635,
    5.754,
    5.864,
    5.965,
    6.055,
    6.135,
    6.204,
    6.263,
    6.311,
    6.349,
    6.379,
    6.401,
    6.416,
    6.426,
    6.431,
    6.435,
    6.438,
    6.442,
    6.45,